id,language,source,question_type,answer_type,question,options,correct_option_index,correct_answer,explanation,section
3a0a0029-17ea-4180-aacd-02c2a02db8b9,hi,json,mcq,single_select,"अमेरिकी राजदूत क्लॉड बॉवर्स के अनुसार, निम्नलिखित में से किस घटना को द्वितीय विश्व युद्ध के लिए ""ड्रेस रिहर्सल"" के रूप में जाना जाता है?","['स्पेन का गृह युद्ध', 'बाल्कन युद्ध', 'मोरक्कन संकट', 'स्वेज नहर संकट']",0,स्पेन का गृह युद्ध,"स्पैनिश गृहयुद्ध स्पेन में 1936 से 1939 तक लड़ा गया गृहयुद्ध था। उस समय के अंतरराष्ट्रीय राजनीतिक माहौल के कारण, युद्ध के कई पहलू थे और इसे विभिन्न रूप से वर्ग संघर्ष, एक धार्मिक संघर्ष, तानाशाही और गणतंत्र लोकतंत्र के बीच संघर्ष, क्रांति और प्रतिक्रांति के बीच और फासीवाद और साम्यवाद के बीच के रूप में देखा गया था। युद्ध के दौरान स्पेन में अमेरिकी राजदूत क्लॉड बोवर्स के अनुसार, यह द्वितीय विश्व युद्ध के लिए ""ड्रेस रिहर्सल"" था। राष्ट्रवादियों ने युद्ध जीता, जो 1939 की शुरुआत में समाप्त हुआ, और नवंबर 1975 में फ्रेंको की मृत्यु तक स्पेन पर शासन किया। अत: विकल्प (A) सही है I",अनुभाग - 1
e75c6942-95c4-4978-891f-3f3d8890c642,hi,json,mcq,single_select,"""तीन आदेश"" का विचार सबसे पहले किस देश में तैयार किया गया था?","['ब्रिटेन', 'फ्रांस', 'अफ्रीका', 'अरब']",1,फ्रांस,"""तीन आदेश"" का विचार पहली बार फ्रांस में ग्यारहवीं शताब्दी की शुरुआत में तैयार किया गया था। इसने समाज को तीन वर्गों में विभाजित किया: प्रार्थना करने वाले, लड़ने वाले और भूमि जोतने वाले। समाज के इस विभाजन को ""तीन आदेशों"" में चर्च द्वारा समाज में अपनी प्रमुख भूमिका को मजबूत करने के लिए समर्थन दिया गया था। इसने नाइट्स नामक एक नए योद्धा समूह के उद्भव में मदद की थी।",अनुभाग - 1
186662ed-5ede-4473-86de-64d8e9cfe834,hi,json,mcq,single_select,"सिंधु जल संधि, 1960 के संदर्भ में निम्नलिखित में से कौन सा कथन सही नहीं है?","['संधि 19 सितम्बर, 1960 में हस्ताक्षरित हुई।', 'संधि के अनुसार भारत, नदी प्रणाली के पानी का 20% भाग उपयोग कर सकता है।', 'संधि के अनुसार भारत, नदी प्रणाली के पानी का 20% भाग उपयोग कर सकता है।', 'संधि के अनुसार, व्यास, रवि और सतलज भारत द्वारा शासित किया जाना चाहिए, जबकि सिंधु, चिनाब और झेलम को पाकिस्तान द्वारा संभाला जाना है।']",1,"संधि के अनुसार भारत, नदी प्रणाली के पानी का 20% भाग उपयोग कर सकता है।","संधि, विवादों को सुलझाने के लिए मध्यस्थता तंत्र प्रदान करती है।",अनुभाग - 1
2e82ca8f-0502-42c1-9cc7-3c05dfd98527,hi,json,mcq,single_select,भारतीय मानसून तंत्र के संदर्भ में निम्नलिखित में से कौन सा तथ्य गलत है?,"['गर्मी में गंगा मैदान पर अंतः उष्णकटिबंधीय अभिसरण क्षेत्र (आईटीसीजेड) की स्थिति में बदलाव।', 'भूमि और पानी के तापन और शीतलन में अंतर।', 'मेडागास्कर के पूर्व में कम दबाव वाले क्षेत्र की उपस्थिति।', 'हिमालय के उत्तर में पश्चिमी भाप धारा की गति और गर्मी के दौरान भारतीय प्रायद्वीप पर उष्णकटिबंधीय पूर्वी भाप धारा की उपस्थिति।']",2,मेडागास्कर के पूर्व में कम दबाव वाले क्षेत्र की उपस्थिति।,"उच्च दबाव वाले क्षेत्र की उपस्थिति, लगभग हिंद महासागर पर 20 डिग्री सेल्सियस है। इस उच्च दबाव वाले क्षेत्र की तीव्रता और स्थिति, भारतीय मानसून को प्रभावित करती है।",अनुभाग - 1
7d88437f-5b16-4ad6-8b1a-7019c6cb951b,hi,json,mcq,single_select,निम्नलिखित में से संभावित संसाधनों का सही स्पष्टीकरण कौन सा है?,"['संसाधन जो एक क्षेत्र में पाए जाते हैं, लेकिन जिनका उपयोग नहीं किया गया है।', 'पर्यावरण की सामग्री जिसमें मानव जरूरतों को पूरा करने की क्षमता है, लेकिन मनुष्यों के पास इन तक पहुंचने के लिए उचित तकनीक नहीं है।', 'संसाधनों का सर्वेक्षण किया जाता है और जिनकी गुणवत्ता और मात्रा को उपयोग के लिए निर्धारित किया जाता है।', ""संसाधन जिन्हें मौजूदा तकनीकी 'जानकारियों' की मदद से उपयोग में लाया जा सकता है, लेकिन उनका उपयोग शुरू नहीं हुआ है।""]",0,"संसाधन जो एक क्षेत्र में पाए जाते हैं, लेकिन जिनका उपयोग नहीं किया गया है।","संभावित संसाधन वे हैं, जो की एक क्षेत्र में पाए जाते हैं, लेकिन इनका उपयोग नहीं किया गया है। उदाहरण के लिए भारत के पश्चिमी हिस्सों, विशेष रूप से राजस्थान और गुजरात में पवन और सौर ऊर्जा के विकास की भारी क्षमता है, लेकिन अब तक इन्हें ठीक से विकसित नहीं किया गया है। विकल्प (A) स्टॉक समझाता है, विकल्प (C) विकसित संसाधनों के बारे में बताता है और विकल्प (D) संरक्षण को समझाता है।",अनुभाग - 1
c103acc1-0c13-4481-8867-4aafbbaac474,hi,json,mcq,single_select,"निम्नलिखित में से कौन सी मिट्टी, भू-दृश्य पर अपनी स्थिति के कारण क्षरण और गिरावट की ओर प्रवृत रहती है?","['जलोढ़ मिट्टी', 'लेटराइट मिट्टी', 'शुष्क मिट्टी', 'लाल और पीली मिट्टी']",1,लेटराइट मिट्टी,"लेटराइट मिट्टी आर्द्र समृद्ध है, जहां यह पर्णपाती और सदाबहार जंगल को पोषण देती हैं, लेकिन दुर्लभ वनस्पति और अर्द्ध शुष्क वातावरण में यह आम तौर पर कमजोर पड़ जाती हैं। ये भू-दृश्य पर अपनी स्थिति के कारण क्षरण और गिरावट के लिए प्रवण रहती हैं।",अनुभाग - 1
7e4bdd5a-6602-4d84-a4e5-15a934164e25,hi,json,mcq,single_select,हिमालयी तालिसपत्र के विषय में निम्नलिखित में से कौन सा कथन गलत है?,"['इसका वैज्ञानिक नाम टेक्सस वालाकीयाना है।', 'यह दुनिया में सबसे ज्यादा बिकने वाली एंटी-कैंसर दवाओं में से एक है।', 'यह हिमाचल प्रदेश, सिक्किम और नागालैंड के विभिन्न हिस्सों में पाया जाता है।', ""टैक्सोल' नामक एक रासायनिक यौगिक इस पेड़ की छाल, सुई, टहनी और जड़ों से निकाला जाता है।""]",2,"यह हिमाचल प्रदेश, सिक्किम और नागालैंड के विभिन्न हिस्सों में पाया जाता है।","हिमालयी तालिसपत्र, हिमाचल प्रदेश और अरुणाचल प्रदेश के विभिन्न हिस्सों में पाया जाने वाला एक औषधीय पौधा हैI",अनुभाग - 1
e4f8009b-c856-4640-9147-23f9de20ebb6,hi,json,mcq,single_select,निम्नलिखित में से कौन फ्रांसीसी क्रांति का नेता नहीं था?,"['मैक्सिमिलिएन रोबेस्पिएरे', 'फ्रेडरिक विलियम IV', 'जॉर्जेस-जैक्स डैंटन', 'जीन पॉल मारत']",1,फ्रेडरिक विलियम IV,"फ्रेडरिक विलियम IV फ्रांसीसी क्रांति के नेता नहीं थे। फ्रांसीसी क्रांति (1789-1799) फ्रांस में सामाजिक और राजनीतिक उथल-पुथल की अवधि थी, जिसके परिणामस्वरूप राजशाही को उखाड़ फेंका गया और गणराज्य की स्थापना हुई। विद्रोहियों के लिए फ्रांसीसी क्रांति के तीन मुख्य नेता जॉर्जेस-जैक्स डैंटन, जीन-पॉल मारत और मैक्सिमिलियन रॉबस्पिएरे थे।",अनुभाग - 1
0ff6cf1a-e99a-4add-988e-94b668a0f205,hi,json,mcq,single_select,निम्नलिखित में से कौन नेपोलियन के उदय का एक कारक था?,"['जैकबिन सरकार का पतन', 'रॉबस्पियर के शासनकाल का आतंक', 'निर्देशिका की राजनीतिक अस्थिरता', 'राष्ट्रवादी ताकत']",2,निर्देशिका की राजनीतिक अस्थिरता,"1792 से 1793 तक फ्रांस एक गणराज्य बना। इसमें जैकबिन सरकार के पतन और निर्देशिका की राजनीतिक अस्थिरता जैसी घटनाएं शामिल हैं। अंत में घटनाओं की श्रृंखला के साथ नेपोलियन फ्रांस का सम्राट बन गया। फ्रांस में निर्देशिका का शासन था, एक कार्यकारी जो पांच सदस्यों से बना था। हालांकि, निर्देशक विधान परिषद के साथ भिड़ गए, जिन्होंने फिर उन्हें खारिज करने की मांग की। निर्देशिका की राजनीतिक अस्थिरता ने सैन्य तानाशाह नेपोलियन बोनापार्ट के उदय का मार्ग प्रशस्त किया। 1804 में खुद को फ्रांस के सम्राट के रूप में मुकुट देने के बाद, वह पड़ोसी यूरोपीय देशों को जीतने के लिए, राजवंशों को तितर-बितर करने और उन राज्यों को बनाने के लिए निकला, जहां उन्होंने अपने परिवार के सदस्यों को रखा था। प्रारंभ में, उन्हें एक मुक्तिदाता के रूप में देखा गया, जो लोगों को स्वतंत्रता दिलाएगा, लेकिन जल्द ही नेपोलियन सेनाओं को एक हमलावर शक्ति के रूप में हर जगह देखा जाने लगा। अंत में, 1804 में, नेपोलियन बोनापार्ट ने खुद को फ्रांस के सम्राट के रूप में ताज पहनाया। इसलिए, सही उत्तर निर्देशिका की राजनीतिक अस्थिरता है।",अनुभाग - 1
762b1123-fca3-4f6e-b3c1-6b8a8c227265,hi,json,mcq,single_select,फ्रांसीसी क्रांति के बारे में निम्नलिखित में से कौन सा कथन सही नहीं है?,"['इसने स्वतंत्रता, स्वाधीनता और समानता के विचारों को जन्म दिया', 'इसने फ्रांस में राजशाही का अंत किया', 'फ्रांसीसी क्रांति की शुरुआत को दर्शाने करने वाली घटना 14 जुलाई, 1789 को बैस्टिल किले की थी', 'फ्रांसीसी क्रांति 1775 और 1783 के बीच लड़ी गई थी']",3,फ्रांसीसी क्रांति 1775 और 1783 के बीच लड़ी गई थी,""" फ्रांसीसी क्रांति 1775 और 1783 के बीच लड़ी गई थी "" यह कथन फ्रांसीसी क्रांति के बारे में सही नहीं है। फ्रांसीसी क्रांति (1789-1799) फ्रांस में सामाजिक और राजनीतिक उथल-पुथल की अवधि थी, जिसके परिणामस्वरूप राजशाही को उखाड़ फेंका गया और गणराज्य की स्थापना हुई। अमेरिकी क्रांति 1775 और 1783 के बीच लड़ी गई थी। अमेरिकी उपनिवेशों ने अमेरिकी शासन की स्थापना के लिए ब्रिटिश शासन को उखाड़ फेंका, अमेरिकी क्रांति के परिणामस्वरूप 1776 में स्वतंत्रता की घोषणा के साथ स्थापना की।",अनुभाग - 1
1f54c448-f2a8-490a-8d16-c5d6e76f48ca,hi,json,mcq,single_select,निम्नलिखित में से कौन सा परिवर्तन पहले औद्योगिक क्रांति के कारण नहीं हुआ है?,"['स्टीम इंजन का बढ़ता उपयोग', 'हाथ उत्पादन विधियों से मशीनों तक संक्रमण', 'मुख्य संकट के रूप में खेती', 'फैक्टरी प्रणाली की स्थापना']",2,मुख्य संकट के रूप में खेती,"'मुख्य संकट के रूप में खेती' पहले औद्योगिक क्रांति के कारण नहीं हुआ है । पहली औद्योगिक क्रांति की शुरुआत ब्रिटेन में हुई थी। इसने पूरी दुनिया को प्रभावित किया है और लोगों के जीवन में भारी बदलाव किया है। औद्योगिक क्रांति के कारण, समाज की एक नई प्रणाली जो 15 वीं शताब्दी से यूरोप में उभर रही थी जिसे पूंजीवाद कहा जाता है। औद्योगिक क्रांति ने भाप इंजन के उपयोग में वृद्धि की है क्योंकि इसके आवेदन में वृद्धि हुई है। जैसे-जैसे उत्पादन का माध्यम बदला है और इसलिए उत्पाद की मांग बढ़ गई है। यह हाथ उत्पादन विधियों से मशीनों और कारखाने प्रणाली को बढ़ाने के लिए संक्रमण में अनुमति देता है।",अनुभाग - 1
92f8a674-d54b-43f1-8429-597e4a866533,hi,json,mcq,single_select,यूएसए में 'नागरिक अधिकार आंदोलन किस कारण से' शुरू किया गया था?,"['सभी समान अधिकारों की मांग करना और सभी अफ्रीकी-अमेरिकी नागरिकों के लिए नस्लीय भेदभाव को दूर करना', 'अफ्रीकी-अमेरिकी पुरुषों के मतदान अधिकारों की मांग करने के लिए', 'अफ्रीकी-अमेरिकी वरिष्ठ नागरिकों की सामाजिक सुरक्षा की मांग करना', 'अफ्रीकी-अमेरिकी महिलाओं के मतदान के अधिकार की मांग करना']",0,सभी समान अधिकारों की मांग करना और सभी अफ्रीकी-अमेरिकी नागरिकों के लिए नस्लीय भेदभाव को दूर करना,"यूएसए में नागरिक अधिकार आंदोलन (1954-1968) अफ्रीकी-अमेरिकियों के खिलाफ कानूनी नस्लीय भेदभाव को समाप्त करने के उद्देश्य से घटनाओं और सुधार आंदोलनों का एक सेट है। मार्टिन लूथर किंग जूनियर के नेतृत्व में, इस आंदोलन ने नस्लीय और भेदभावपूर्ण कानूनों और प्रथाओं के खिलाफ नागरिक अवज्ञा के अहिंसक तरीकों का अभ्यास किया। अफ्रीकी-अमेरिकी, एफ्रो-अमेरिकन, ब्लैक अमेरिकन या ब्लैक का उपयोग मुख्य रूप से अफ्रीकी के वंशजों को संदर्भित करने के लिए किया जाता है, जिन्हें 17वीं शताब्दी और 19वीं शताब्दी की शुरुआत के बीच अमेरिका में दास के रूप में लाया गया था। ब्लैक पावर आंदोलन 1966 में उभरा और 1975 तक चला, जो एक अधिक उग्रवादी विरोधी नस्लवादी आंदोलन था, जो अमेरिका में नस्लवाद को समाप्त करने के लिए आवश्यक होने पर भी हिंसा की वकालत करता था।",अनुभाग - 1
